{
  "schemaVersion": "golden-path-tooling-cutoff/v1",
  "checkedAt": "2026-08-01T11:21:19Z",
  "standardVersion": "2026.07",
  "releaseVersion": "1.0.0",
  "miseMinimumVersion": "2026.7.18",
  "integrityRecords": [
    {"path":"go.sum","sha256":"774eb57b3d32487d74e26213fe6b836e7543e4b7fbee166dee02c8c4f95c843d"},
    {"path":"mise.lock","sha256":"0720116a8dff9aa53f18af3dca2c19f8e3b07e0d64ed067f4a89408e82b38c71"},
    {"path":"templates/bundle.json","sha256":"35a6cdffd8089cefe62a1b3e12255048c4e194cf2ee9c79184e815c5a45f2a43"},
    {"path":"templates/profiles/go/go.sum.tmpl","sha256":"17fca5f51216eac1b0741c569ef1456c08acecc99b95327ab66720a3f112348b"},
    {"path":"templates/profiles/node-typescript/pnpm-lock.base.yaml.tmpl","sha256":"b989ffdce281860be196e3da56b183a71854c43fac0e64316db09f941d0c4fe2"},
    {"path":"templates/profiles/node-typescript/pnpm-lock.cdk.yaml.tmpl","sha256":"250306a9792b34ace38a7be5353cea1a2c00cc66ddba3c209cbf6a3ba6cf638f"},
    {"path":"templates/profiles/node-typescript/pnpm-lock.pulumi.yaml.tmpl","sha256":"f262c9e36b0de97915774498665a92f843a6cc24f8f6cfd4d18630023358f02c"},
    {"path":"templates/profiles/python/.python-version.tmpl","sha256":"54447b334a0e618b8695f5793a9c931c15320490bbbda173ae96809133e6412f"},
    {"path":"templates/profiles/python/uv.lock.tmpl","sha256":"1e529c44218ab4b36a190f4f3f372458290f9a051c2fdea4ea176b498bcd5b89"},
    {"path":"templates/profiles/rust/rust-toolchain.toml.tmpl","sha256":"a4dcbec5f6f0a1f8ebb62633e4e1d386c2586909fe3a00ccbf871e32e43b06e2"},
    {"path":"templates/tooling/mise.lock","sha256":"592303996fd11dda3776f7d912ba12b1536051e0dfc62215e8288d2381f904c5"}
  ],
  "toolSelections": [
    {
      "id": "actionlint",
      "version": "1.7.12",
      "supportStatus": "supported",
      "officialSource": "https://github.com/rhysd/actionlint/releases/tag/v1.7.12",
      "integrityAuthority": "mise-lock",
      "integrityEvidence": ["templates/tooling/mise.lock"]
    },
    {
      "id": "aws-cdk",
      "version": "2.1134.0",
      "supportStatus": "supported",
      "officialSource": "https://www.npmjs.com/package/aws-cdk/v/2.1134.0",
      "integrityAuthority": "pnpm-lock",
      "integrityEvidence": ["templates/profiles/node-typescript/pnpm-lock.cdk.yaml.tmpl"]
    },
    {
      "id": "aws-cdk-lib",
      "version": "2.262.2",
      "supportStatus": "compatibility-pinned",
      "officialSource": "https://www.npmjs.com/package/aws-cdk-lib/v/2.262.2",
      "integrityAuthority": "pnpm-lock",
      "integrityEvidence": ["templates/profiles/node-typescript/pnpm-lock.cdk.yaml.tmpl"],
      "latestObservedVersion": "2.263.0",
      "selectionReason": "The latest release had not satisfied pnpm's minimum-release-age policy at the cutoff; 2.262.2 is the newest admitted lock resolution."
    },
    {
      "id": "constructs",
      "version": "10.8.0",
      "supportStatus": "supported",
      "officialSource": "https://www.npmjs.com/package/constructs/v/10.8.0",
      "integrityAuthority": "pnpm-lock",
      "integrityEvidence": ["templates/profiles/node-typescript/pnpm-lock.cdk.yaml.tmpl"]
    },
    {
      "id": "eslint",
      "version": "10.8.0",
      "supportStatus": "supported",
      "officialSource": "https://www.npmjs.com/package/eslint/v/10.8.0",
      "integrityAuthority": "pnpm-lock",
      "integrityEvidence": ["templates/profiles/node-typescript/pnpm-lock.base.yaml.tmpl"]
    },
    {
      "id": "eslint-js",
      "version": "10.0.1",
      "supportStatus": "supported",
      "officialSource": "https://www.npmjs.com/package/@eslint/js/v/10.0.1",
      "integrityAuthority": "pnpm-lock",
      "integrityEvidence": ["templates/profiles/node-typescript/pnpm-lock.base.yaml.tmpl"]
    },
    {
      "id": "github-cli",
      "version": "2.97.0",
      "supportStatus": "supported",
      "officialSource": "https://github.com/cli/cli/releases/tag/v2.97.0",
      "integrityAuthority": "mise-lock",
      "integrityEvidence": ["mise.lock", "templates/tooling/mise.lock"]
    },
    {
      "id": "go",
      "version": "1.26.5",
      "supportStatus": "preferred",
      "officialSource": "https://go.dev/dl/",
      "integrityAuthority": "mise-lock",
      "integrityEvidence": ["mise.lock", "templates/tooling/mise.lock"]
    },
    {
      "id": "goimports",
      "version": "0.48.0",
      "supportStatus": "supported",
      "officialSource": "https://pkg.go.dev/golang.org/x/tools/cmd/goimports@v0.48.0",
      "integrityAuthority": "go-sum",
      "integrityEvidence": ["go.sum", "templates/profiles/go/go.sum.tmpl"]
    },
    {
      "id": "golangci-lint",
      "version": "2.12.2",
      "supportStatus": "supported",
      "officialSource": "https://github.com/golangci/golangci-lint/releases/tag/v2.12.2",
      "integrityAuthority": "mise-lock",
      "integrityEvidence": ["mise.lock", "templates/tooling/mise.lock"]
    },
    {
      "id": "just",
      "version": "1.57.0",
      "supportStatus": "supported",
      "officialSource": "https://github.com/casey/just/releases/tag/1.57.0",
      "integrityAuthority": "mise-lock",
      "integrityEvidence": ["mise.lock", "templates/tooling/mise.lock"]
    },
    {
      "id": "mypy",
      "version": "2.3.0",
      "supportStatus": "supported",
      "officialSource": "https://pypi.org/project/mypy/2.3.0/",
      "integrityAuthority": "uv-lock",
      "integrityEvidence": ["templates/profiles/python/uv.lock.tmpl"]
    },
    {
      "id": "node",
      "version": "24.18.1",
      "supportStatus": "preferred",
      "officialSource": "https://nodejs.org/dist/v24.18.1/",
      "integrityAuthority": "mise-lock",
      "integrityEvidence": ["templates/tooling/mise.lock"]
    },
    {
      "id": "node-types",
      "version": "24.13.3",
      "supportStatus": "compatibility-pinned",
      "officialSource": "https://www.npmjs.com/package/@types/node/v/24.13.3",
      "integrityAuthority": "pnpm-lock",
      "integrityEvidence": ["templates/profiles/node-typescript/pnpm-lock.base.yaml.tmpl"],
      "latestObservedVersion": "26.1.2",
      "selectionReason": "The type package is pinned to the preferred Node.js 24 line rather than the unrelated latest major."
    },
    {
      "id": "opentofu",
      "version": "1.12.5",
      "supportStatus": "supported",
      "officialSource": "https://github.com/opentofu/opentofu/releases/tag/v1.12.5",
      "integrityAuthority": "mise-lock",
      "integrityEvidence": ["templates/tooling/mise.lock"]
    },
    {
      "id": "pnpm",
      "version": "11.18.0",
      "supportStatus": "supported",
      "officialSource": "https://www.npmjs.com/package/pnpm/v/11.18.0",
      "integrityAuthority": "release-checksum",
      "integrityEvidence": ["templates/bundle.json"]
    },
    {
      "id": "prettier",
      "version": "3.9.6",
      "supportStatus": "supported",
      "officialSource": "https://www.npmjs.com/package/prettier/v/3.9.6",
      "integrityAuthority": "pnpm-lock",
      "integrityEvidence": ["templates/profiles/node-typescript/pnpm-lock.base.yaml.tmpl"]
    },
    {
      "id": "pulumi",
      "version": "3.255.0",
      "supportStatus": "supported",
      "officialSource": "https://github.com/pulumi/pulumi/releases/tag/v3.255.0",
      "integrityAuthority": "mise-lock",
      "integrityEvidence": ["templates/tooling/mise.lock"]
    },
    {
      "id": "pulumi-sdk",
      "version": "3.255.0",
      "supportStatus": "supported",
      "officialSource": "https://www.npmjs.com/package/@pulumi/pulumi/v/3.255.0",
      "integrityAuthority": "pnpm-lock",
      "integrityEvidence": ["templates/profiles/node-typescript/pnpm-lock.pulumi.yaml.tmpl"]
    },
    {
      "id": "pytest",
      "version": "9.1.1",
      "supportStatus": "supported",
      "officialSource": "https://pypi.org/project/pytest/9.1.1/",
      "integrityAuthority": "uv-lock",
      "integrityEvidence": ["templates/profiles/python/uv.lock.tmpl"]
    },
    {
      "id": "python",
      "version": "3.14.6",
      "supportStatus": "preferred",
      "officialSource": "https://www.python.org/downloads/release/python-3146/",
      "integrityAuthority": "native-manager",
      "integrityEvidence": ["templates/profiles/python/.python-version.tmpl"]
    },
    {
      "id": "ruff",
      "version": "0.16.1",
      "supportStatus": "supported",
      "officialSource": "https://pypi.org/project/ruff/0.16.1/",
      "integrityAuthority": "uv-lock",
      "integrityEvidence": ["templates/profiles/python/uv.lock.tmpl"]
    },
    {
      "id": "rust",
      "version": "1.97.1",
      "supportStatus": "preferred",
      "officialSource": "https://blog.rust-lang.org/2026/07/16/Rust-1.97.1/",
      "integrityAuthority": "native-manager",
      "integrityEvidence": ["templates/profiles/rust/rust-toolchain.toml.tmpl"]
    },
    {
      "id": "terraform",
      "version": "1.15.8",
      "supportStatus": "supported",
      "officialSource": "https://releases.hashicorp.com/terraform/1.15.8/",
      "integrityAuthority": "mise-lock",
      "integrityEvidence": ["templates/tooling/mise.lock"]
    },
    {
      "id": "typescript",
      "version": "6.0.3",
      "supportStatus": "compatibility-pinned",
      "officialSource": "https://www.npmjs.com/package/typescript/v/6.0.3",
      "integrityAuthority": "pnpm-lock",
      "integrityEvidence": ["templates/profiles/node-typescript/pnpm-lock.base.yaml.tmpl"],
      "latestObservedVersion": "7.0.2",
      "selectionReason": "typescript-eslint 8.65.0 declares TypeScript >=4.8.4 and <6.1.0; TypeScript 7 is outside the supported peer range."
    },
    {
      "id": "typescript-eslint",
      "version": "8.65.0",
      "supportStatus": "supported",
      "officialSource": "https://www.npmjs.com/package/typescript-eslint/v/8.65.0",
      "integrityAuthority": "pnpm-lock",
      "integrityEvidence": ["templates/profiles/node-typescript/pnpm-lock.base.yaml.tmpl"]
    },
    {
      "id": "uv",
      "version": "0.12.1",
      "supportStatus": "supported",